{
  "schemaVersion": 1,
  "generatedAt": "2026-09-02T09:22:55Z",
  "title": "JUPITER Booster: ресурси, NUMA, accounting і сценарії використання",
  "allocation": {
    "account": "e-dev-2026d09-128",
    "system": "jupiter",
    "partition": "booster",
    "periodStart": "2026-09-01",
    "periodEnd": "2027-02-28",
    "sourceIds": ["live-cpuquota"]
  },
  "sources": [
    {
      "id": "jsc-tech",
      "confidence": "high",
      "title": "JUPITER Technical Overview",
      "publisher": "Juelich Supercomputing Centre",
      "url": "https://www.fz-juelich.de/en/jsc/jupiter/tech/",
      "snapshotPath": "evidence/official/jsc-tech.html",
      "retrievedAt": "2026-09-02",
      "version": "page updated 2026-06-26",
      "updatedAt": "2026-06-26",
      "kind": "web"
    },
    {
      "id": "jsc-config",
      "confidence": "high",
      "title": "JUPITER Configuration",
      "publisher": "Juelich Supercomputing Centre",
      "url": "https://apps.fz-juelich.de/jsc/hps/jupiter/configuration.html",
      "snapshotPath": "evidence/official/jsc-config.html",
      "retrievedAt": "2026-09-02",
      "version": "live documentation snapshot 2026-09-02",
      "kind": "web"
    },
    {
      "id": "jsc-batch",
      "confidence": "high",
      "title": "JUPITER Batch System",
      "publisher": "Juelich Supercomputing Centre",
      "url": "https://apps.fz-juelich.de/jsc/hps/jupiter/batchsystem.html",
      "snapshotPath": "evidence/official/jsc-batch.html",
      "retrievedAt": "2026-09-02",
      "version": "live documentation snapshot 2026-09-02",
      "kind": "web"
    },
    {
      "id": "jsc-accounting",
      "confidence": "high",
      "title": "JUPITER Accounting",
      "publisher": "Juelich Supercomputing Centre",
      "url": "https://apps.fz-juelich.de/jsc/hps/jupiter/accounting.html",
      "snapshotPath": "evidence/official/jsc-accounting.html",
      "retrievedAt": "2026-09-02",
      "version": "live documentation snapshot 2026-09-02",
      "kind": "web"
    },
    {
      "id": "jsc-affinity",
      "confidence": "high",
      "title": "JUPITER Processor Affinity",
      "publisher": "Juelich Supercomputing Centre",
      "url": "https://apps.fz-juelich.de/jsc/hps/jupiter/affinity.html",
      "snapshotPath": "evidence/official/jsc-affinity.html",
      "retrievedAt": "2026-09-02",
      "version": "live documentation snapshot 2026-09-02",
      "kind": "web"
    },
    {
      "id": "jsc-gpu",
      "confidence": "high",
      "title": "JUPITER GPU Computing",
      "publisher": "Juelich Supercomputing Centre",
      "url": "https://apps.fz-juelich.de/jsc/hps/jupiter/gpu-computing.html",
      "snapshotPath": "evidence/official/jsc-gpu.html",
      "retrievedAt": "2026-09-02",
      "version": "live documentation snapshot 2026-09-02",
      "kind": "web"
    },
    {
      "id": "jsc-filesystems",
      "confidence": "high",
      "title": "JUPITER File Systems",
      "publisher": "Juelich Supercomputing Centre",
      "url": "https://apps.fz-juelich.de/jsc/hps/jupiter/filesystems.html",
      "snapshotPath": "evidence/official/jsc-filesystems.html",
      "retrievedAt": "2026-09-02",
      "version": "live documentation snapshot 2026-09-02",
      "kind": "web"
    },
    {
      "id": "jsc-buildup",
      "confidence": "high",
      "title": "JUPITER Build-Up Operation",
      "publisher": "Juelich Supercomputing Centre",
      "url": "https://apps.fz-juelich.de/jsc/hps/jupiter/buildup.html",
      "snapshotPath": "evidence/official/jsc-buildup.html",
      "retrievedAt": "2026-09-02",
      "version": "live documentation snapshot 2026-09-02",
      "kind": "web"
    },
    {
      "id": "jsc-data-transfer",
      "confidence": "high",
      "title": "Data Transfer to and from JUPITER",
      "publisher": "Juelich Supercomputing Centre",
      "url": "https://apps.fz-juelich.de/jsc/hps/jupiter/data-transfer.html",
      "snapshotPath": "evidence/official/jsc-data-transfer.html",
      "retrievedAt": "2026-09-02",
      "version": "live documentation snapshot 2026-09-02",
      "kind": "web"
    },
    {
      "id": "jsc-datamover",
      "confidence": "high",
      "title": "JUPITER Data Mover Service",
      "publisher": "Juelich Supercomputing Centre",
      "url": "https://apps.fz-juelich.de/jsc/hps/jupiter/datamover.html",
      "snapshotPath": "evidence/official/jsc-datamover.html",
      "retrievedAt": "2026-09-02",
      "version": "live documentation snapshot 2026-09-02",
      "kind": "web"
    },
    {
      "id": "nvidia-grace",
      "confidence": "high",
      "title": "NVIDIA Grace Performance Tuning Guide",
      "publisher": "NVIDIA",
      "url": "https://docs.nvidia.com/dccpu/grace-perf-tuning-guide/",
      "snapshotPath": "evidence/official/nvidia-grace.html",
      "retrievedAt": "2026-09-02",
      "version": "live documentation snapshot 2026-09-02",
      "kind": "web"
    },
    {
      "id": "nvidia-cuda-memory",
      "confidence": "high",
      "title": "CUDA Programming Guide: Understanding Memory",
      "publisher": "NVIDIA",
      "url": "https://docs.nvidia.com/cuda/cuda-programming-guide/02-basics/understanding-memory.html",
      "snapshotPath": "evidence/official/nvidia-cuda-memory.html",
      "retrievedAt": "2026-09-02",
      "version": "live documentation snapshot 2026-09-02",
      "kind": "web"
    },
    {
      "id": "nvidia-nccl",
      "confidence": "high",
      "title": "NCCL Performance Tuning",
      "publisher": "NVIDIA",
      "url": "https://docs.nvidia.com/deeplearning/nccl/user-guide/docs/troubleshooting/performance_and_tuning.html",
      "snapshotPath": "evidence/official/nvidia-nccl.html",
      "retrievedAt": "2026-09-02",
      "version": "live documentation snapshot 2026-09-02",
      "kind": "web"
    },
    {
      "id": "eurohpc-systems",
      "confidence": "high",
      "title": "EuroHPC Supercomputers",
      "publisher": "EuroHPC Joint Undertaking",
      "url": "https://www.eurohpc-ju.europa.eu/supercomputers/our-supercomputers_en",
      "snapshotPath": "evidence/official/eurohpc-systems.html",
      "retrievedAt": "2026-09-02",
      "version": "page retrieved 2026-09-02",
      "kind": "web"
    },
    {
      "id": "eviden-xh3000",
      "confidence": "medium",
      "title": "BullSequana XH3000",
      "publisher": "Eviden",
      "url": "https://eviden.com/wp-content/uploads/2024/10/Eviden-brochure-BullSequanaXH3000-HPC.pdf",
      "snapshotPath": "evidence/official/eviden-xh3000.pdf",
      "retrievedAt": "2026-09-02",
      "version": "brochure 2024",
      "kind": "web"
    },
    {
      "id": "live-snapshot",
      "confidence": "high",
      "title": "JUPITER allocation and Slurm snapshot",
      "publisher": "U-LM observed evidence",
      "url": "evidence/live/manifest.txt",
      "retrievedAt": "2026-09-02",
      "version": "snapshot 2026-09-02T00:59:31Z",
      "kind": "live"
    },
    {
      "id": "live-sinfo",
      "confidence": "high",
      "title": "Slurm partition state snapshot",
      "publisher": "U-LM observed evidence",
      "url": "evidence/live/sinfo.txt",
      "retrievedAt": "2026-09-02",
      "version": "snapshot 2026-09-02T00:59:31Z",
      "kind": "live"
    },
    {
      "id": "live-partition-booster",
      "confidence": "high",
      "title": "Slurm booster partition snapshot",
      "publisher": "U-LM observed evidence",
      "url": "evidence/live/partition-booster.txt",
      "retrievedAt": "2026-09-02",
      "version": "snapshot 2026-09-02T00:59:31Z",
      "kind": "live"
    },
    {
      "id": "live-partition-largebooster",
      "confidence": "high",
      "title": "Slurm largebooster partition snapshot",
      "publisher": "U-LM observed evidence",
      "url": "evidence/live/partition-largebooster.txt",
      "retrievedAt": "2026-09-02",
      "version": "snapshot 2026-09-02T00:59:31Z",
      "kind": "live"
    },
    {
      "id": "live-cpuquota",
      "confidence": "high",
      "title": "Project CPU quota snapshot",
      "publisher": "U-LM observed evidence",
      "url": "evidence/live/cpu-quota.json",
      "retrievedAt": "2026-09-02",
      "version": "snapshot 2026-09-02T00:59:31Z",
      "kind": "live"
    },
    {
      "id": "live-dataquota",
      "confidence": "high",
      "title": "Project storage quota snapshot",
      "publisher": "U-LM observed evidence",
      "url": "evidence/live/data-quota.json",
      "retrievedAt": "2026-09-02",
      "version": "quota updated 2026-09-02T01:23:16 local service time",
      "kind": "live"
    },
    {
      "id": "live-user-dataquota",
      "confidence": "high",
      "title": "User HOME quota snapshot",
      "publisher": "U-LM observed evidence",
      "url": "evidence/live/user-data-quota.json",
      "retrievedAt": "2026-09-02",
      "version": "quota updated 2026-09-02T01:20:00 local service time",
      "kind": "live"
    },
    {
      "id": "baseline-1618664",
      "confidence": "high",
      "title": "Four-GPU nvidia-smi baseline job 1618664",
      "publisher": "U-LM observed evidence",
      "url": "evidence/live/baseline-job.txt",
      "retrievedAt": "2026-09-02",
      "version": "Slurm job 1618664",
      "kind": "artifact"
    },
    {
      "id": "gpu-baseline-output",
      "confidence": "high",
      "title": "Four-GPU nvidia-smi output",
      "publisher": "U-LM observed evidence",
      "url": "evidence/probes/jupiter-gpu-check-1618664.out",
      "retrievedAt": "2026-09-02",
      "version": "Slurm job 1618664",
      "kind": "artifact"
    },
    {
      "id": "topology-1618998",
      "confidence": "high",
      "title": "Full-node topology probe 1618998",
      "publisher": "U-LM observed evidence",
      "url": "evidence/probes/jupiter-topology-1618998.out",
      "retrievedAt": "2026-09-02",
      "version": "Slurm job 1618998",
      "kind": "artifact"
    },
    {
      "id": "onegpu-1618999",
      "confidence": "high",
      "title": "One-GPU accounting probe 1618999",